{
  "metadata": {
    "title": "마지막 예배",
    "duration_minutes": 10,
    "target_length": 3000,
    "genre": "testimony",
    "total_scenes": 4,
    "total_characters": 2
  },
  "characters": [
    {
      "id": "char_01",
      "name": "박용팔",
      "age": "일흔여섯 살",
      "gender": "남성",
      "role": "주인공",
      "occupation": "시골 교회 목사",
      "relationship_to_protagonist": "본인",
      "appearance": {
        "height": "중간 키에 약간 구부정한 자세",
        "body_type": "마른 체형, 뼈가 앙상함",
        "face": "깊은 주름, 선한 눈, 두꺼운 눈썹",
        "hair": "백발이 섞인 짧은 머리",
        "skin": "햇볕에 그을린 거친 피부",
        "distinctive_features": "두꺼운 검정테 안경"
      },
      "clothing_style": "낡은 양복, 헌 구두",
      "personality": "과묵하지만 따뜻함, 인내심 강함",
      "speaking_style": "느리고 차분한 말투, 경상도 억양",
      "voice_characteristics": "낮고 갈라지는 목소리"
    },
    {
      "id": "char_02",
      "name": "김순덕",
      "age": "일흔세 살",
      "gender": "여성",
      "role": "조연",
      "occupation": "목사 아내, 권사",
      "relationship_to_protagonist": "아내",
      "appearance": {
        "height": "작은 키",
        "body_type": "통통한 편",
        "face": "둥근 얼굴, 자애로운 미소",
        "hair": "짧은 파마 머리, 희끗희끗",
        "skin": "검버섯이 있는 피부",
        "distinctive_features": "항상 앞치마를 두름"
      },
      "clothing_style": "수수한 한복 또는 편한 옷",
      "personality": "다정다감, 걱정이 많음",
      "speaking_style": "부드럽고 따뜻한 말투",
      "voice_characteristics": "조금 높은 음색, 정감 있는 목소리"
    }
  ],
  "highlight": {
    "purpose": "시청자 이탈 방지 - 극적 장면 미리보기",
    "duration_seconds": 60,
    "type": "climax_preview",
    "scenes": [
      {
        "order": 1,
        "preview_text": "사십칠 년 만에 기적이 일어났습니다. 그날, 저는 마지막 예배를 준비하고 있었습니다.",
        "scene_hint": "빈 교회에서 홀로 설교문을 읽는 노목사",
        "emotion": "절망과 희망의 교차"
      },
      {
        "order": 2,
        "preview_text": "교회 문이 끼익 소리를 내며 열렸습니다. 그 순간, 저는 믿을 수가 없었습니다.",
        "scene_hint": "문이 열리고 빛이 들어오는 장면",
        "emotion": "놀라움과 감격"
      }
    ]
  },
  "script": {
    "scenes": [
      {
        "scene_meta": {
          "scene_id": 1,
          "scene_title": "시골 목사의 일상",
          "structure_phase": "인사_및_자기소개",
          "location": {
            "place": "경북 영덕군 병곡면 작은 마을 교회",
            "setting": "낡은 나무 십자가, 삐걱거리는 의자 열다섯 개",
            "indoor_outdoor": "실내"
          },
          "time": {
            "period": "이른 아침",
            "season": "늦가을",
            "weather": "쌀쌀하고 흐림"
          },
          "atmosphere": {
            "mood": "고요하고 쓸쓸함",
            "lighting": "창문으로 들어오는 희미한 아침 빛",
            "sound_ambience": "새벽 새소리, 멀리서 개 짖는 소리"
          },
          "visual_direction": {
            "camera_suggestion": "교회 전경에서 시작해 설교단의 노목사로 줌인",
            "key_visual": "빈 의자들 사이에 홀로 서 있는 목사",
            "color_tone": "차가운 회색빛, 약간의 따뜻한 나무색"
          },
          "characters_in_scene": ["char_01"],
          "character_states": {
            "char_01": {
              "emotion": "담담함 속 외로움",
              "expression": "먼 곳을 바라보는 눈",
              "posture": "설교단에 두 손을 짚고 서 있음",
              "action": "빈 의자들을 바라보며 한숨"
            }
          }
        },
        "narration": "안녕하세요. 저는 경북 영덕군 병곡면, 바닷바람이 매섭게 부는 작은 마을에서 사십칠 년째 목회를 하고 있는 박용팔 목사입니다. 올해 일흔여섯 살이 되었습니다. 이 교회는 제가 이십아홉 살, 신학교를 갓 졸업하고 처음 부임한 곳입니다. 그때만 해도 마을에 열다섯 가구가 살았고, 주일이면 마흔 명 가까이 이 좁은 예배당을 채웠습니다."
      },
      {
        "scene_meta": {
          "scene_id": 2,
          "scene_title": "좋았던 시절의 기억",
          "structure_phase": "상황_설명",
          "location": {
            "place": "같은 교회, 과거 회상",
            "setting": "사람들로 북적이는 예배당",
            "indoor_outdoor": "실내"
          },
          "time": {
            "period": "주일 아침",
            "season": "봄",
            "weather": "화창함"
          },
          "atmosphere": {
            "mood": "따뜻하고 활기참",
            "lighting": "밝은 햇살",
            "sound_ambience": "찬송가 소리, 아이들 웃음소리"
          },
          "visual_direction": {
            "camera_suggestion": "과거 회상 톤으로 부드러운 전환",
            "key_visual": "함께 찬송하는 마을 사람들",
            "color_tone": "따뜻한 세피아 톤"
          },
          "characters_in_scene": ["char_01", "char_02"],
          "character_states": {
            "char_01": {
              "emotion": "행복과 감사",
              "expression": "환한 미소",
              "posture": "당당하게 서서 설교",
              "action": "열정적으로 말씀 전함"
            },
            "char_02": {
              "emotion": "뿌듯함",
              "expression": "흐뭇한 미소",
              "posture": "맨 앞줄에 앉아 있음",
              "action": "남편의 설교를 경청"
            }
          }
        },
        "narration": "김권사님, 이권사님, 박집사님. 세 분이 교회의 기둥이었습니다. 김권사님은 매주 새벽기도 때 가장 먼저 오셔서 예배당 청소를 하셨습니다. 여든일곱 살까지 그러셨습니다. 이권사님은 손이 크셔서 항상 점심 국수를 말아 주셨고, 박집사님은 찬양 인도를 맡으셨는데 목소리가 어찌나 우렁차던지, 마을 끝에서도 들릴 정도였습니다. 제 아내 순덕이, 아니 순덕 권사도 주방에서 늘 바쁘게 움직였습니다. 그때는 정말 행복했습니다."
      },
      {
        "scene_meta": {
          "scene_id": 3,
          "scene_title": "하나씩 떠나는 사람들",
          "structure_phase": "갈등_발생",
          "location": {
            "place": "교회와 마을 곳곳",
            "setting": "점점 비어가는 공간들",
            "indoor_outdoor": "혼합"
          },
          "time": {
            "period": "여러 시기",
            "season": "사계절",
            "weather": "다양함"
          },
          "atmosphere": {
            "mood": "점점 어두워지는 분위기",
            "lighting": "흐려지는 빛",
            "sound_ambience": "바람 소리, 적막"
          },
          "visual_direction": {
            "camera_suggestion": "시간의 흐름을 보여주는 몽타주",
            "key_visual": "하나씩 비어가는 의자들",
            "color_tone": "점점 차가워지는 색감"
          },
          "characters_in_scene": ["char_01", "char_02"],
          "character_states": {
            "char_01": {
              "emotion": "슬픔과 무력감",
              "expression": "눈가에 눈물",
              "posture": "어깨가 처짐",
              "action": "장례식 집례, 빈 의자 바라봄"
            },
            "char_02": {
              "emotion": "걱정과 슬픔",
              "expression": "근심 어린 표정",
              "posture": "남편 옆에 서서 손을 잡음",
              "action": "남편을 위로함"
            }
          }
        },
        "narration": "그런데 세월이 흐르면서 하나 둘씩 떠나기 시작했습니다. 김권사님은 여든일곱 살에 하나님 품에 안기셨습니다. 이 년 뒤 이권사님도 가셨습니다. 젊은 사람들은 일자리를 찾아 대구로, 서울로 떠났습니다. 마을에 남은 건 저와 아내, 그리고 여든이 넘은 박집사님뿐이었습니다. 작년 겨울, 박집사님마저 요양원으로 가셨습니다. 주일 예배에 남은 건 저와 아내 단 두 명이었습니다. 빈 의자 열다섯 개가 저를 바라보고 있었습니다. 저는 매주 그 빈 의자들을 향해 설교를 했습니다."
      },
      {
        "scene_meta": {
          "scene_id": 4,
          "scene_title": "기적의 순간",
          "structure_phase": "하나님의_개입",
          "location": {
            "place": "교회 예배당",
            "setting": "마지막 예배를 준비한 공간",
            "indoor_outdoor": "실내"
          },
          "time": {
            "period": "주일 아침",
            "season": "늦가을",
            "weather": "맑음"
          },
          "atmosphere": {
            "mood": "극적인 반전",
            "lighting": "문이 열리며 쏟아지는 빛",
            "sound_ambience": "문 여는 소리, 발자국 소리"
          },
          "visual_direction": {
            "camera_suggestion": "문에서 빛이 쏟아지는 드라마틱한 샷",
            "key_visual": "역광 속에 서 있는 사람들의 실루엣",
            "color_tone": "어둠에서 밝음으로 전환"
          },
          "characters_in_scene": ["char_01", "char_02"],
          "character_states": {
            "char_01": {
              "emotion": "놀라움에서 감격으로",
              "expression": "눈물이 흐르는 얼굴",
              "posture": "멈춰 선 채 바라봄",
              "action": "말을 잇지 못함"
            },
            "char_02": {
              "emotion": "감격과 기쁨",
              "expression": "눈물 흘리며 미소",
              "posture": "두 손 모음",
              "action": "감사 기도"
            }
          }
        },
        "narration": "어느 날 밤, 저는 아내와 마주 앉아 이야기했습니다. 여보, 이제 그만해도 되지 않을까요. 사십칠 년이면 충분히 했잖아요. 아내는 아무 말 없이 제 손을 잡았습니다. 우리는 마지막 예배를 드리기로 했습니다. 그 주일 아침, 저는 떨리는 손으로 설교문을 펼쳤습니다. 그때였습니다. 끼익, 교회 문이 열리는 소리가 들렸습니다. 고개를 들었습니다. 믿을 수가 없었습니다. 문 앞에 스무 명 가까운 사람들이 서 있었습니다. 이십 년 전에 이 마을을 떠났던 청년들이, 이제는 머리가 희끗해진 모습으로 돌아온 것입니다. 그들의 손에는 아이들 손이 잡혀 있었습니다. 저는 그 자리에서 주저앉아 울었습니다. 하나님께서는 끝이라고 생각한 바로 그 순간에 새로운 시작을 주셨습니다. 여러분은 어떠신가요? 지금 인생에서 마지막이라고 느끼는 순간을 겪고 계신가요? 기억하세요. 하나님께서는 우리가 포기하려는 바로 그때, 기적을 준비하고 계십니다. 좋아요와 구독 부탁드립니다. 댓글로 여러분의 이야기를 나눠주세요."
      }
    ]
  }
}
